Account;Tweet_Nr;Date_Time;Tweet;;;;;;;;
realDonaldTrump;1151451068431290000;17.07.2019 11:18;b'....they are destroying the Democrat Party. I\xe2\x80\x99m appalled that so many of our Presidential candidates are falling all over themselves to try to agree with the four horsewomen of the apocalypse. I\xe2\x80\x99m entitled to say that they\xe2\x80\x99re Wack Jobs.\xe2\x80\x9d  Louisiana Senator John Kennedy';;;;;;;;
realDonaldTrump;1151451067437190000;17.07.2019 11:18;b'...opinion they\xe2\x80\x99re Americans. Now I\xe2\x80\x99m entitled to my opinion &amp;;;;;;;;
realDonaldTrump;1151451061670080000;17.07.2019 11:18;"b'\xe2\x80\x9cIn America if you hate our Country you are free to leave. The simple fact of the matter is the four Congresswomen think that America is wicked in its origins they think that America is even more wicked now that we are all racist and evil. They\xe2\x80\x99re entitled to their.....'""";;;;;;;;
realDonaldTrump;1151327084016480000;17.07.2019 03:05;"b'....visible members of the House Democrats who are now wedded to this bitterness and hate. The Republican vote was 187-4. Wow! Also this was the first time since 1984 that the Speaker of the House was ruled Out of Order and broke the Rules of the House. Quite a day!'""";;;;;;;;
realDonaldTrump;1151327083110510000;17.07.2019 03:05;"b'So great to see how unified the Republican Party was on today\xe2\x80\x99s vote concerning statements I made about four Democrat Congresswomen. If you really want to see statements look at the horrible things they said about our Country Israel and much more. They are now the top most...'""";;;;;;;;
realDonaldTrump;1151251538079300000;16.07.2019 22:05;"b'Yesterday it was my great honor to host our third annual Made in America Showcase at the @WhiteHouse.... https://t.co/mBha7Qprr9'""";;;;;;;;
realDonaldTrump;1151246142769940000;16.07.2019 21:44;"b'Looking forward to tomorrow night\xe2\x80\x99s rally in Greenville North Carolina at 7:00 P.M. Eastern! https://t.co/oXRgDvjacc'""";;;;;;;;
realDonaldTrump;1151147417028490000;16.07.2019 15:11;"b'Kevin McCarthy @GOPLeader \xe2\x80\x9cThe President\xe2\x80\x99s Tweets were not Racist. The controversy over the tweets is ALL POLITICS. I will vote against this resolution.\xe2\x80\x9d  Thank you Kevin!'""";;;;;;;;
realDonaldTrump;1151129281919100000;16.07.2019 13:59;"b'.....Congresswomen who I truly believe based on their actions hate our Country. Get a list of the HORRIBLE things they have said. Omar is polling at 8% Cortez at 21%. Nancy Pelosi tried to push them away but now they are forever wedded to the Democrat Party. See you in 2020!'""";;;;;;;;
realDonaldTrump;1151129281134760000;16.07.2019 13:59;"b'Those Tweets were NOT Racist. I don\xe2\x80\x99t have a Racist bone in my body! The so-called vote to be taken is a Democrat con game. Republicans should not show \xe2\x80\x9cweakness\xe2\x80\x9d and fall into their trap. This should be a vote on the filthy language statements and lies told by the Democrat.....'""";;;;;;;;
realDonaldTrump;1151103647637480000;16.07.2019 12:17;"b'Our Country is Free Beautiful and Very Successful. If you hate our Country or if you are not happy here you can leave!'""";;;;;;;;
realDonaldTrump;1151099363445350000;16.07.2019 12:00;"b'If you come after the President the Country the Flag - he\xe2\x80\x99s going to defend himself. What the squad doesn\xe2\x80\x99t like is that Donald Trump is enforcing the very laws that are on the books that were put there by Congress.\xe2\x80\x9d Jason Chaffetz. Also buy Jason\xe2\x80\x99s great new book POWER GRAB!'""";;;;;;;;
realDonaldTrump;1151095675213550000;16.07.2019 11:46;b'\xe2\x80\x9cBillionaire Tech Investor Peter Thiel believes Google should be investigated for treason. He accuses Google of working with the Chinese Government.\xe2\x80\x9d @foxandfriends  A great and brilliant guy who knows this subject better than anyone! The Trump Administration will take a look!';;;;;;;;
realDonaldTrump;1151089269538210000;16.07.2019 11:20;"b'.....shouting of the F...word among many other terrible things and the petrified Dems run for the hills. Why isn\xe2\x80\x99t the House voting to rebuke the filthy and hate laced things they have said? Because they are the Radical Left and the Democrats are afraid to take them on. Sad!'""";;;;;;;;
realDonaldTrump;1151089268535760000;16.07.2019 11:20;b'The Democrat Congresswomen have been spewing some of the most vile hateful and disgusting things ever said by a politician in the House or Senate &amp;;;;;;;;
realDonaldTrump;1150948978218970000;16.07.2019 02:03;b'\xe2\x80\x9cThe best economy in our lifetime!\xe2\x80\x9d @IngrahamAngle';;;;;;;;
realDonaldTrump;1150886874325630000;15.07.2019 21:56;b'MAKE AMERICA GREAT AGAIN!';;;;;;;;
realDonaldTrump;1150883529141730000;15.07.2019 21:43;"b'The Obama Administration built the Cages not the Trump Administration! DEMOCRATS MUST GIVE US THE VOTES TO CHANGE BAD IMMIGRATION LAWS.'""";;;;;;;;
realDonaldTrump;1150879404593200000;15.07.2019 21:26;"b'The Dems were trying to distance themselves from the four \xe2\x80\x9cprogressives\xe2\x80\x9d but now they are forced to embrace them. That means they are endorsing Socialism hate of Israel and the USA! Not good for the Democrats!'""";;;;;;;;
realDonaldTrump;1150874784642860000;15.07.2019 21:08;"b'....Detention facilities are not Concentration Camps! America has never been stronger than it is now \xe2\x80\x93 rebuilt Military highest Stock Market EVER lowest unemployment and more people working than ever before. Keep America Great!'""";;;;;;;;
realDonaldTrump;1150874783309090000;15.07.2019 21:08;"b'....They are anti-Israel pro Al-Qaeda and comment on the 9/11 attack \xe2\x80\x9csome people did something.\xe2\x80\x9d Radical Left Democrats want Open Borders which means drugs crime human trafficking and much more....'""";;;;;;;;
realDonaldTrump;1150874781744600000;15.07.2019 21:08;"b'We will never be a Socialist or Communist Country. IF YOU ARE NOT HAPPY HERE YOU CAN LEAVE! It is your choice and your choice alone. This is about love for America. Certain people HATE our Country....'""";;;;;;;;
realDonaldTrump;1150779375358480000;15.07.2019 14:49;"b'Here we go with the Fake Polls. Just like what happened with the Election against Crooked Hillary Clinton. ABC NBC CNN @nytimes @washingtonpost they all got it wrong on purpose. Suppression Polls so early? They will never learn!'""";;;;;;;;
realDonaldTrump;1150766498459390000;15.07.2019 13:58;"b'.....to impeach President Trump on DAY ONE. Make them the face of the future of the Democrat Party you will destroy the Democrat Party. Their policies will destroy our Country!\xe2\x80\x9d  @LindseyGrahamSC  Need I say more?'""";;;;;;;;
realDonaldTrump;1150766497469480000;15.07.2019 13:58;"b'....What does it mean for America to have free Healthcare for Illegal Immigrants no criminalization of coming into our Country - See how that works for controlling Immigration! They talk about Israel like they\xe2\x80\x99re a bunch of thugs not victims of the entire region. They wanted...'""";;;;;;;;
realDonaldTrump;1150766496462920000;15.07.2019 13:58;"b'....they are Anti-Semitic they are Anti-America we don\xe2\x80\x99t need to know anything about them personally talk about their policies. I think they are American citizens who are duly elected that are running on an agenda that is disgusting that the American people will reject......'""";;;;;;;;
realDonaldTrump;1150766494697100000;15.07.2019 13:58;"b'\xe2\x80\x9cWe all know that AOC and this crowd are a bunch of Communists they hate Israel they hate our own Country they\xe2\x80\x99re calling the guards along our Border (the Border Patrol Agents) Concentration Camp Guards they accuse people who support Israel as doing it for the Benjamin\xe2\x80\x99s....'""";;;;;;;;
realDonaldTrump;1150732346099970000;15.07.2019 11:42;b'If Democrats want to unite around the foul language &amp;;;;;;;;
realDonaldTrump;1150720283654930000;15.07.2019 10:54;b'When will the Radical Left Congresswomen apologize to our Country the people of Israel and even to the Office of the President for the foul language they have used and the terrible things they have said. So many people are angry at them &amp;;;;;;;;
realDonaldTrump;1150717475421660000;15.07.2019 10:43;b'....with the U.S. and wishes it had not broken the original deal in the first place. In the meantime we are receiving Billions of Dollars in Tariffs from China with possibly much more to come. These Tariffs are paid for by China devaluing &amp;;;;;;;;
realDonaldTrump;1150717474624690000;15.07.2019 10:43;b'China\xe2\x80\x99s 2nd Quarter growth is the slowest it has been in more than 27 years. The United States Tariffs are having a major effect on companies wanting to leave China for non-tariffed countries. Thousands of companies are leaving. This is why China wants to make a deal....';;;;;;;;
realDonaldTrump;1150590096527300000;15.07.2019 02:17;"b'We are doing great Economically as a Country Number One despite the Fed\xe2\x80\x99s antiquated policy on rates and tightening. Much room to grow!'""";;;;;;;;
realDonaldTrump;1150556166566630000;15.07.2019 00:02;"b'....and the many terrible things they say about the United States must not be allowed to go unchallenged. If the Democrat Party wants to continue to condone such disgraceful behavior then we look even more forward to seeing you at the ballot box in 2020!'""";;;;;;;;
realDonaldTrump;1150556162393300000;15.07.2019 00:02;"b'So sad to see the Democrats sticking up for people who speak so badly of our Country and who in addition hate Israel with a true and unbridled passion. Whenever confronted they call their adversaries including Nancy Pelosi \xe2\x80\x9cRACIST.\xe2\x80\x9d Their disgusting language.....'""";;;;;;;;
realDonaldTrump;1150472779596220000;14.07.2019 18:31;"b'Think what it would be without the 3 year Witch Hunt and Fake News Media in partnership with the Democrats! https://t.co/KBtl7wde0F'""";;;;;;;;
realDonaldTrump;1150435615210640000;14.07.2019 16:03;b'https://t.co/YaiCXrxYQq';;;;;;;;
realDonaldTrump;1150400998097260000;14.07.2019 13:45;"b'.....Sorry can\xe2\x80\x99t let them into our Country. If too crowded tell them not to come to USA and tell the Dems to fix the Loopholes - Problem Solved!'""";;;;;;;;
realDonaldTrump;1150400995177950000;14.07.2019 13:45;"b'Friday\xe2\x80\x99s tour showed vividly to politicians and the media how well run and clean the children\xe2\x80\x99s detention centers are. Great reviews! Failing @nytimes story was FAKE! The adult single men areas were clean but crowded - also loaded up with a big percentage of criminals......'""";;;;;;;;
realDonaldTrump;1150384263088520000;14.07.2019 12:39;"b'Thank you so nice but we are getting it done anyway! https://t.co/w2fhJK6FmF'""";;;;;;;;
realDonaldTrump;1150381396994720000;14.07.2019 12:27;"b'....it is done. These places need your help badly you can\xe2\x80\x99t leave fast enough. I\xe2\x80\x99m sure that Nancy Pelosi would be very happy to quickly work out free travel arrangements!'""";;;;;;;;
realDonaldTrump;1150381395078000000;14.07.2019 12:27;"b'....and viciously telling the people of the United States the greatest and most powerful Nation on earth how our government is to be run. Why don\xe2\x80\x99t they go back and help fix the totally broken and crime infested places from which they came. Then come back and show us how....'""";;;;;;;;
realDonaldTrump;1150381394234940000;14.07.2019 12:27;"b'So interesting to see \xe2\x80\x9cProgressive\xe2\x80\x9d Democrat Congresswomen who originally came from countries whose governments are a complete and total catastrophe the worst most corrupt and inept anywhere in the world (if they even have a functioning government at all) now loudly......'""";;;;;;;;
realDonaldTrump;1150366822547560000;14.07.2019 11:29;b'A big risk of major flooding in large parts of Louisiana and all across the Gulf Coast. Please be very careful!';;;;;;;;
realDonaldTrump;1150153250806680000;13.07.2019 21:21;"b'94% Approval Rating in the Republican Party an all time high. Ronald Reagan was 87%. Thank you!'""";;;;;;;;
realDonaldTrump;1150152762044440000;13.07.2019 21:19;b'....Paul Ryan almost killed the Republican Party. Weak ineffective &amp;;;;;;;;
realDonaldTrump;1150152760362430000;13.07.2019 21:19;"b'House Minority Leader Kevin McCarthy is a far superior leader than was Lame Duck Speaker Paul Ryan. Tougher smarter and a far better fundraiser Kevin is already closing in on 44 Million Dollars. Paul\xe2\x80\x99s final year numbers were according to Breitbart \xe2\x80\x9cabysmal.\xe2\x80\x9d People like.....'""";;;;;;;;
realDonaldTrump;1150017240395390000;13.07.2019 12:20;b'This is one of the most horrible abuses of all. Those texts between gaga lovers would have told the whole story. Illegal deletion by Mueller. They gave us \xe2\x80\x9cthe insurance policy.\xe2\x80\x9d https://t.co/EEa41Kn6fX';;;;;;;;
realDonaldTrump;1150011125347620000;13.07.2019 11:56;"b'Andy McCabe is a major sleazebag. Among many other things he took massive amounts of money from Crooked Hillary reps for wife\xe2\x80\x99s campaign while Hillary was under \xe2\x80\x9cinvestigation\xe2\x80\x9d by FBI! https://t.co/bHweiBBj7z'""";;;;;;;;
realDonaldTrump;1149896948507430000;13.07.2019 04:22;b'\xe2\x80\x9cMUELLER\xe2\x80\x99S PARTISAN WITCH HUNT!\xe2\x80\x9d https://t.co/XTD5f5ZOz2';;;;;;;;
realDonaldTrump;1149893888951360000;13.07.2019 04:10;"b'""""EXPOSING THE REAL 2016 ELECTION SCANDAL!"""" https://t.co/WUNOSKZC6T'""";;;;;;;;
realDonaldTrump;1149889094664800000;13.07.2019 03:51;"b'""""BOOMERANG OF JUSTICE"""" @SeanHannity https://t.co/MUbkCXRpfM'""";;;;;;;;
realDonaldTrump;1149886161432790000;13.07.2019 03:39;b'Just returned to the beautiful @WhiteHouse after a great day in Wisconsin and Ohio! https://t.co/WVp3KeKg8h';;;;;;;;
realDonaldTrump;1149849263268140000;13.07.2019 01:13;b'Leaving the Great State of Ohio! https://t.co/WTLC1fFzWl';;;;;;;;
realDonaldTrump;1149812548625190000;12.07.2019 22:47;b'The DOW S&amp;;;;;;;;
realDonaldTrump;1149779387077790000;12.07.2019 20:35;b'Tennessee loving Bill Hagerty who was my Tennessee Victoy Chair and is now the very outstanding Ambassador to Japan will be running for the U.S. Senate. He is strong on crime borders &amp;;;;;;;;
realDonaldTrump;1149777787747800000;12.07.2019 20:29;b'I am thrilled to be back in the Great State of Wisconsin with the extraordinary men &amp;;;;;;;;
realDonaldTrump;1149715365741700000;12.07.2019 16:21;b'We have a GREAT TEAM in Pennsylvania! I\xe2\x80\x99m proud to say that our good friends Lawrence Tabas &amp;;;;;;;;
realDonaldTrump;1149693842263640000;12.07.2019 14:55;"b'....Alex was a great Secretary of Labor and his service is truly appreciated. He will be replaced on an acting basis by Pat Pizzella the current Deputy Secretary.'""";;;;;;;;
realDonaldTrump;1149693838300020000;12.07.2019 14:55;"b'Alex Acosta informed me this morning that he felt the constant drumbeat of press about a prosecution which took place under his watch more than 12 years ago was bad for the Administration which he so strongly believes in and he graciously tendered his resignation....'""";;;;;;;;
realDonaldTrump;1149665175722530000;12.07.2019 13:01;"b'Wow @CNN RATINGS HAVE CRASHED. LOST ALL CREDIBILITY!'""";;;;;;;;
realDonaldTrump;1149663362428520000;12.07.2019 12:54;b'Great job by Rush Limbaugh on @foxandfriends!';;;;;;;;
realDonaldTrump;1149661698829230000;12.07.2019 12:48;b'.....if Mexico produces (which I think they will). Biggest part of deal with Mexico has not yet been revealed! China is similar except they devalue currency &amp;;;;;;;;
realDonaldTrump;1149661697675680000;12.07.2019 12:48;"b'....companies to come to the USA and to get companies that have left us for other lands to COME BACK HOME. We  stupidly lost 30% of our auto business to Mexico. If the Tariffs went on at the higher level they would all come back and fast. But very happy with the deal I made...'""";;;;;;;;
realDonaldTrump;1149661694735470000;12.07.2019 12:48;"b'When you are the big \xe2\x80\x9cpiggy bank\xe2\x80\x9d that other countries have been ripping off for years (to a level that is not to be believed) Tariffs are a great negotiating tool a great revenue producer and  most importantly a powerful way to get......'""";;;;;;;;
realDonaldTrump;1149658628552440000;12.07.2019 12:35;"b'@SebGorka Wins Big No Contest!'""";;;;;;;;
realDonaldTrump;1149649772921230000;12.07.2019 12:00;b'The Great Rush Limbaugh will be on @foxandfriends at 8:30 A.M. Enjoy!';;;;;;;;
realDonaldTrump;1149647962215040000;12.07.2019 11:53;b'Thank you Lara and Jessie Jane! https://t.co/FPNhslghzd';;;;;;;;
realDonaldTrump;1149524000957030000;12.07.2019 03:40;b'Interesting! https://t.co/Ttwa6mymGr';;;;;;;;
realDonaldTrump;1149517347805250000;12.07.2019 03:14;b'Thank you! https://t.co/0EFV8qa9a3';;;;;;;;
realDonaldTrump;1149516403075980000;12.07.2019 03:10;b'....He had the Majority &amp;;;;;;;;
realDonaldTrump;1149516401868060000;12.07.2019 03:10;b'....When Mitt chose Paul I told people that\xe2\x80\x99s the end of that Presidential run. He quit Congress because he didn\xe2\x80\x99t know how to Win. They gave me standing O\xe2\x80\x99s in the Great State of Wisconsin &amp;;;;;;;;
realDonaldTrump;1149516400341340000;12.07.2019 03:10;b'Paul Ryan the failed V.P. candidate &amp;;;;;;;;
realDonaldTrump;1149506080549980000;12.07.2019 02:29;b'Do you believe this kind of bravery? Amazing drug seizure. WATCH! https://t.co/M1KKBFic4A';;;;;;;;
realDonaldTrump;1149477795308780000;12.07.2019 00:37;b'#SocialMediaSummit @WhiteHouse https://t.co/Z7tlvC3QUN';;;;;;;;
realDonaldTrump;1149476254476680000;12.07.2019 00:31;"b'Each of you is fulfilling a vital role in our nation \xe2\x80\x93 you are challenging the media gatekeepers and the corporate censors to bring the facts straight to the American People. Together you reach more people than any television broadcast BY FAR! #SocialMediaSummit https://t.co/iWePOOhLgp'""";;;;;;;;
realDonaldTrump;1149472285905940000;12.07.2019 00:15;"b'...and International. We have only one real currency in the USA and it is stronger than ever both dependable and reliable. It is by far the most dominant currency anywhere in the World and it will always stay that way. It is called the United States Dollar!'""";;;;;;;;
realDonaldTrump;1149472284702200000;12.07.2019 00:15;"b'....Similarly Facebook Libra\xe2\x80\x99s \xe2\x80\x9cvirtual currency\xe2\x80\x9d will have little standing or dependability. If Facebook and other companies want to become a bank they must seek a new Banking Charter and become subject to all Banking Regulations just like other Banks both National...'""";;;;;;;;
realDonaldTrump;1149472282584070000;12.07.2019 00:15;"b'I am not a fan of Bitcoin and other Cryptocurrencies which are not money and whose value is highly volatile and based on thin air. Unregulated Crypto Assets can facilitate unlawful behavior including drug trade and other illegal activity....'""";;;;;;;;
realDonaldTrump;1149467665209020000;11.07.2019 23:57;b'To everyone on the Gulf Coast: As you make preparations to protect your homes &amp;;;;;;;;
realDonaldTrump;1149453628639530000;11.07.2019 23:01;"b'Today I am directing my Administration to explore all regulatory and legislative solutions to protect the free speech rights of ALL AMERICANS. We hope to see more transparency more accountability and more FREEDOM! #SocialMediaSummit \nhttps://t.co/i6th5qtfAj'""";;;;;;;;
realDonaldTrump;1149345683138360000;11.07.2019 15:52;"b'...or a very nervous and skinny version of Pocahontas (1/1024th) as your President rather than what you have now so great looking and smart a true Stable Genius! Sorry to say that even Social Media would be driven out of business along with and finally the Fake News Media!'""";;;;;;;;
realDonaldTrump;1149345681829740000;11.07.2019 15:52;"b'...years or maybe 10 or 14 (just kidding) they will quickly go out of business for lack of credibility or approval from the public. That\xe2\x80\x99s why they will all be Endorsing me at some point one way or the other. Could you imagine having Sleepy Joe Biden or Alfred E. Newman...'""";;;;;;;;
realDonaldTrump;1149345680189720000;11.07.2019 15:52;"b'...The Fake News is not as important or as powerful as Social Media. They have lost tremendous credibility since that day in November 2016 that I came down the escalator with the person who was to become your future First Lady. When I ultimately leave office in six...'""";;;;;;;;
realDonaldTrump;1149345678814060000;11.07.2019 15:52;"b'A big subject today at the White House Social Media Summit will be the tremendous dishonesty bias discrimination and suppression practiced by certain companies. We will not let them get away with it much longer. The Fake News Media will also be there but for a limited period..'""";;;;;;;;
realDonaldTrump;1149334626311290000;11.07.2019 15:08;b'So happy that I was able to keep Sikorsky Helicopter in the Great State of Pennsylvania. KEEP AMERICA GREAT!';;;;;;;;
realDonaldTrump;1149330559379890000;11.07.2019 14:52;"b'Dow just hit 27000 for first time EVER!'""";;;;;;;;
realDonaldTrump;1149320643818720000;11.07.2019 14:12;b'\xe2\x80\x9cIt seems that the Brits and the French and the Germans are coming around to the idea that the Iranians are up to no good!\xe2\x80\x9d @BillHemmer @FoxNews';;;;;;;;
realDonaldTrump;1149318492711260000;11.07.2019 14:04;"b'Mexico is doing great at the Border but China is letting us down in that they have not been buying the agricultural products from our great Farmers that they said they would. Hopefully they will start soon!'""";;;;;;;;
realDonaldTrump;1149317762843630000;11.07.2019 14:01;b'Will be a big and exciting day at the White House for Social Media!';;;;;;;;
realDonaldTrump;1149317469544370000;11.07.2019 14:00;"b'....conflicted and compromised Mueller again. He said he was \xe2\x80\x9cdone\xe2\x80\x9d after his last 9 minute speech and that he had nothing more to say outside of the No Collusion No Obstruction Report. Enough already go back to work! I won unanimously the big Emoluments case yesterday!'""";;;;;;;;
realDonaldTrump;1149317468730660000;11.07.2019 14:00;"b'Now the Democrats have asked to see 12 more people who have already spent hours with Robert Mueller and spent a fortune on lawyers in so doing. How many bites at the apple do they get before working on Border Loopholes and Asylum. They also want to interview the highly......'""";;;;;;;;
realDonaldTrump;1149289425836360000;11.07.2019 12:08;"b'Democrats had to quickly take down a tweet called \xe2\x80\x9cKids In Cages Inhumane Treatment at the Border\xe2\x80\x9d because the horrible picture used was from the Obama years. Very embarrassing! @foxandfriends'""";;;;;;;;
realDonaldTrump;1149283451415270000;11.07.2019 11:45;"b'....And remember a bank that I did use years ago the now badly written about and maligned Deutsche Bank was then one of the largest and most prestigious banks in the world! They wanted my business and so did many others!'""";;;;;;;;
realDonaldTrump;1149283449196410000;11.07.2019 11:45;"b'The Fake News Media loves the narrative that I didn\xe2\x80\x99t use many banks because the banks didn\xe2\x80\x99t like me. No I didn\xe2\x80\x99t use many banks because I didn\xe2\x80\x99t (don\xe2\x80\x99t) need their money (old fashioned isn\xe2\x80\x99t it?). If I did it would have been very easy for me to get.'""";;;;;;;;
realDonaldTrump;1149282695064800000;11.07.2019 11:42;"b'....the number of people who are no longer looking for jobs but who are now seeing the opportunity for job growth you\xe2\x80\x99ve got to give the President an A Plus for that.\xe2\x80\x9d  Thank you Robert one of our great business leaders!'""";;;;;;;;
realDonaldTrump;1149282693022140000;11.07.2019 11:42;"b'Robert Johnson B.E.T. \xe2\x80\x9cI give the President a lot of credit for moving the Economy in a positive direction that\xe2\x80\x99s benefiting a large number of Americans. I think the Tax Cuts clearly helped stimulate the Economy. Overall if you look at the U.S. Economy and you look at.....'""";;;;;;;;
realDonaldTrump;1149282146634400000;11.07.2019 11:39;"b'....months the lowest since 1972.\xe2\x80\x9d The Wall Street Journal Editorial Board A Tale of Two Economies. @IngrahamAngle'""";;;;;;;;
realDonaldTrump;1149282144411370000;11.07.2019 11:39;"b'\xe2\x80\x9cNearly one million more blacks and two million more Hispanics are employed than when Barrack Obama left office and minorities account for more than half of all new jobs created during the Trump Presidency. Unemployment among black women has hovered near 5% for the last six.....'""";;;;;;;;
realDonaldTrump;1149281529727760000;11.07.2019 11:37;"b'The Pledge of Allegiance to our great Country in St. Louis Park Minnesota is under siege. That is why I am going to win the Great State of Minnesota in the 2020 Election. People are sick and tired of this stupidity and disloyalty to our wonderful USA!'""";;;;;;;;
realDonaldTrump;1149266929565260000;11.07.2019 10:39;"b'The White House will be hosting a very big and very important Social Media Summit today. Would I have become President without Social Media? Yes (probably)! At its conclusion we will all go to the beautiful Rose Garden for a News Conference on the Census and Citizenship.'""";;;;;;;;
realDonaldTrump;1149109159570390000;11.07.2019 00:12;b'THANK YOU BILL! https://t.co/ToNeu9OGuM';;;;;;;;
realDonaldTrump;1149108122990060000;11.07.2019 00:08;b'Thank you so much @JonVoight!\nhttps://t.co/7aj57QH57l';;;;;;;;
realDonaldTrump;1149107726565460000;11.07.2019 00:06;"b'....Thank you to Lockheed Martin one of the USA\xe2\x80\x99s truly great companies!'""";;;;;;;;
