Account;Tweet_Nr;Date_Time;Tweet;;;;;;;;
realDonaldTrump;1169782689257440000;06.09.2019 01:21;"b'Looking forward to watching @SarahHuckabee Sanders tomorrow morning on @FoxandFriends by far the #1 rated show on Morning Cable at 8:30am. Sarah will be an incredible addition to @FoxNews!'""";;;;;;;;
realDonaldTrump;1169759456277720000;05.09.2019 23:49;"b'Great job done by @GovRonDesantis @SenRickScott Senator @MarcoRubio and all of the those from Florida that were so brilliantly involved including @FEMA @USCG Law Enforcement and First Responders. Thank you all!'""";;;;;;;;
realDonaldTrump;1169758141795450000;05.09.2019 23:44;"b'Just got off the phone with Governor Brian Kemp (@GovKemp) of Georgia. Happy to hear that things are looking good for everyone. I stand by ready to assist along with our great team at @FEMA \xe2\x80\x93 we\xe2\x80\x99re with you ALL THE WAY!'""";;;;;;;;
realDonaldTrump;1169756027035800000;05.09.2019 23:35;"b'Just spoke to Governor @HenryMcMaster of South Carolina regarding Hurricane Dorian. I informed Henry that we are monitoring South Carolina and stand by ready to assist. Be safe everyone we are totally with you!'""";;;;;;;;
realDonaldTrump;1169753952130350000;05.09.2019 23:27;"b'Just talked to Governor Roy Cooper of North Carolina as Hurricane Dorian ominously comes up the East Coast. We are monitoring it at the @WhiteHouse ready to assist via our great team over at @FEMA who are already on site. We are with you all the way North Carolina. BE SAFE!'""";;;;;;;;
realDonaldTrump;1169706294242130000;05.09.2019 20:18;b'I was with you all the way Alabama. The Fake News Media was not! https://t.co/gO5pwahaj9';;;;;;;;
realDonaldTrump;1169705282123040000;05.09.2019 20:14;"b'Just as I said Alabama was originally projected to be hit. The Fake News denies it! https://t.co/elJ7ROfm2p'""";;;;;;;;
realDonaldTrump;1169637650627740000;05.09.2019 15:45;b'....His dedication to Israel and to seeking peace between Israel and the Palestinians won\xe2\x80\x99t be forgotten. He will be missed. Thank you Jason!';;;;;;;;
realDonaldTrump;1169637649151400000;05.09.2019 15:45;"b'After almost 3 years in my Administration Jason Greenblatt will be leaving to pursue work in the private sector. Jason has been a loyal and great friend and fantastic lawyer....'""";;;;;;;;
realDonaldTrump;1169606328945450000;05.09.2019 13:40;b'Really Good Jobs Numbers!';;;;;;;;
realDonaldTrump;1169606058148600000;05.09.2019 13:39;"b'Alabama was going to be hit or grazed and then Hurricane Dorian took a different path (up along the East Coast). The Fake News knows this very well. That\xe2\x80\x99s why they\xe2\x80\x99re the Fake News!'""";;;;;;;;
realDonaldTrump;1169600039188160000;05.09.2019 13:15;"b'....said what she did even being on a much higher rated show she would have been thrown off television. Will Fake News NBC allow a McCarthy style Racist to continue? ABC fired Roseanne. Watch the double standard!'""";;;;;;;;
realDonaldTrump;1169600037053240000;05.09.2019 13:15;b'Bad \xe2\x80\x9cactress\xe2\x80\x9d Debra The Mess Messing is in hot water. She wants to create a \xe2\x80\x9cBlacklist\xe2\x80\x9d of Trump supporters &amp;;;;;;;;
realDonaldTrump;1169578155948070000;05.09.2019 11:48;"b'....Instead it turned North and went up the coast where it continues now. In the one model through Florida the Great State of Alabama would have been hit or grazed. In the path it took no. Read my FULL FEMA statement. What I said was accurate! All Fake News in order to demean!'""";;;;;;;;
realDonaldTrump;1169578155096580000;05.09.2019 11:48;b'In the early days of the hurricane when it was predicted that Dorian would go through Miami or West Palm Beach even before it reached the Bahamas certain models strongly suggested that Alabama &amp;;;;;;;;
realDonaldTrump;1169459039132100000;05.09.2019 03:55;b'Thank you Rad - looking great! https://t.co/YeKXSNjKwW';;;;;;;;
realDonaldTrump;1169455923712220000;05.09.2019 03:43;b'Thank you Terrence. Best Employment Numbers In History for African Americans! https://t.co/YCf2WT4XHt';;;;;;;;
realDonaldTrump;1169415182029900000;05.09.2019 01:01;b'https://t.co/bxSiT2zQDj';;;;;;;;
realDonaldTrump;1169412199611320000;05.09.2019 00:49;"b'....information does come out.\xe2\x80\x9d Charlie Hurt Washington Times  @LouDobbs'""";;;;;;;;
realDonaldTrump;1169412198692730000;05.09.2019 00:49;"b'....facts and that should terrify every American regardless of their political stripe. The idea that all of that information hasn\xe2\x80\x99t already been revealed shows how dastardly these people are and how terrified they are about what\xe2\x80\x99s going to happen when that....'""";;;;;;;;
realDonaldTrump;1169412197841350000;05.09.2019 00:49;b'\xe2\x80\x9cAbsolutely nothing is more important than going back &amp;;;;;;;;
realDonaldTrump;1169375550806350000;04.09.2019 22:23;"b'This was the originally projected path of the Hurricane in its early stages. As you can see almost all models predicted it to go through Florida also hitting Georgia and Alabama. I accept the Fake News apologies! https://t.co/0uCT0Qvyo6'""";;;;;;;;
realDonaldTrump;1169366511439550000;04.09.2019 21:47;b'State Rep Greg Murphy is running for Congress in North Carolina District 3. We really need Greg in Washington. He is great w/ the Military our Vets &amp;;;;;;;;
realDonaldTrump;1169356705857180000;04.09.2019 21:08;"b'7. The badly flawed Paris Climate Agreement protects the polluters hurts Americans and cost a fortune. NOT ON MY WATCH!\n\n8. I want crystal clean water and the cleanest and the purest air on the planet \xe2\x80\x93 we\xe2\x80\x99ve now got that!'""";;;;;;;;
realDonaldTrump;1169356704926100000;04.09.2019 21:08;"b""""6. The Democrats\xe2\x80\x99 destructive \xe2\x80\x9cenvironmental\xe2\x80\x9d proposals will raise your energy bill and prices at the pump. \n\nDon't the Democrats care about fighting American poverty?""""""";;;;;;;;
realDonaldTrump;1169356704028510000;04.09.2019 21:08;"b""""4. The U.S. now leads the world in energy production...\n\nBUT...\n \n5. Who's got the world's cleanest and safest air and water? \n\nAMERICA!""""""";;;;;;;;
realDonaldTrump;1169356703126770000;04.09.2019 21:08;b'1. Which country has the largest carbon emission reduction?\n\nAMERICA!\n\n2. Who has dumped the most carbon into the air?  \n \nCHINA!\n\n3. 91% of the world\xe2\x80\x99s population are exposed to air pollution above the World Health Organization\xe2\x80\x99s suggested level.  \n \nNONE ARE IN THE U.S.A.!';;;;;;;;
realDonaldTrump;1169356701943890000;04.09.2019 21:08;b'8 FACTS that #FakeNewsCNN will ignore in tonight\xe2\x80\x99s \xe2\x80\x9cClimate Forum\xe2\x80\x9d';;;;;;;;
realDonaldTrump;1169253301138910000;04.09.2019 14:18;"b'....We can\xe2\x80\x99t have a system where we run our entire economy for the benefit of other countries which have long charged us big tariffs. Don\xe2\x80\x99t keep ducking the reality. The U.S. has been subject to Tariff Terrorism for 50 years. But a real deal can be done.\xe2\x80\x9d Sam Zell @JoeSquawk'""";;;;;;;;
realDonaldTrump;1169253299981300000;04.09.2019 14:18;"b'....Trump is doing to China is not lost on the rest of the world. Europe has had among the most protectionist policies forever. They\xe2\x80\x99re sitting there and saying gee are we next? Maybe you are! We\xe2\x80\x99ve got to change the rules. The U.S. can\xe2\x80\x99t defend the world and pay for it....'""";;;;;;;;
realDonaldTrump;1169253298169430000;04.09.2019 14:18;"b'\xe2\x80\x9cThe Chinese are very adept at not accepting anything. You\xe2\x80\x99ve got to be very tough and that\xe2\x80\x99s what Trump is doing. It\xe2\x80\x99s in China\xe2\x80\x99s interest to correct and I think we\xe2\x80\x99ll end up with a solution that\xe2\x80\x99s dramatically better than we have today. Frankly I think the impact of what...'""";;;;;;;;
realDonaldTrump;1169246982508070000;04.09.2019 13:52;b'\xe2\x80\x9cU.S. Winning Trade War With China In Dollars.\xe2\x80\x9d CNBC';;;;;;;;
realDonaldTrump;1169062380040520000;04.09.2019 01:39;b'.....on the President of the United States.\xe2\x80\x9d @charliekirk11 @trish_regan';;;;;;;;
realDonaldTrump;1169062379134570000;04.09.2019 01:39;"b'\xe2\x80\x9cTo declassify is so important because if this were a Democrat President or a Democrat Candidate that was spied on the way President Trump was spied on this would be a scandal that would make Watergate look like nothing. Illegal spying.....'""";;;;;;;;
realDonaldTrump;1169053562904670000;04.09.2019 01:04;"b'\xe2\x80\x9cI am so tired of hearing the rationalization of the Left in the country because they hate Donald Trump. Inexplicably and without foundation they choose to hate America. The Democrats have truly become the party of hate.\xe2\x80\x9d @LouDobbs'""";;;;;;;;
realDonaldTrump;1169050760098790000;04.09.2019 00:53;b'The truth is that we have a nation that is disgusted with the FBI. We have a crisis of confidence in the number one law enforcement agency in this country (thanks Comey!). @LouDobbs \xe2\x80\x9cIt\xe2\x80\x99s a scandal.\xe2\x80\x9d @AlanDersh';;;;;;;;
realDonaldTrump;1169048221026590000;04.09.2019 00:43;"b'At the request of Senator Thom Tillis I am getting the North Carolina Emergency Declaration completed and signed tonight. Hope you won\xe2\x80\x99t need it!'""";;;;;;;;
realDonaldTrump;1169002093476290000;03.09.2019 21:39;"b'The U.S. may be getting a little bit lucky with respect to Hurricane Dorian but please don\xe2\x80\x99t let down your guard. As it heads up the coast lots of very bad and unpredictable things can happen! On the other hand the Bahamas have been devastated. We are sending crews to help!'""";;;;;;;;
realDonaldTrump;1168997258945320000;03.09.2019 21:20;b'@NHC_Atlantic';;;;;;;;
realDonaldTrump;1168898509841550000;03.09.2019 14:48;"b'....\xe2\x80\x9dknife crime\xe2\x80\x9d which is totally out of control in London. People are afraid to even walk the streets. He is a terrible mayor who should stay out of our business!'""";;;;;;;;
realDonaldTrump;1168898508608420000;03.09.2019 14:48;"b'The incompetent Mayor of London Sadiq Khan was bothered that I played a very fast round of golf yesterday. Many Pols exercise for hours or travel for weeks. Me I run through one of my courses (very inexpensive). President Obama would fly to Hawaii. Kahn should focus on....'""";;;;;;;;
realDonaldTrump;1168893583283420000;03.09.2019 14:28;"b'Based on the IG Report the whole Witch Hunt against me and my administration was a giant and illegal SCAM. The House of Representatives should now get back to work on drug prices healthcare infrastructure and all else. The Mueller Report showed No Collusion No Obstruction!'""";;;;;;;;
realDonaldTrump;1168882690713690000;03.09.2019 13:45;"b'Germany and so many other countries have negative interest rates \xe2\x80\x9cthey get paid for loaning money\xe2\x80\x9d and our Federal Reserve fails to act! Remember these are also our weak currency competitors!'""";;;;;;;;
realDonaldTrump;1168879633984640000;03.09.2019 13:33;b'For all of the \xe2\x80\x9cgeniuses\xe2\x80\x9d out there many who have been in other administrations and \xe2\x80\x9ctaken to the cleaners\xe2\x80\x9d by China that want me to get together with the EU and others to go after China Trade practices remember the EU &amp;;;;;;;;
realDonaldTrump;1168874292626500000;03.09.2019 13:12;"b'....And then think what happens to China when I win. Deal would get MUCH TOUGHER! In the meantime China\xe2\x80\x99s Supply Chain will crumble and businesses jobs and money will be gone!'""";;;;;;;;
realDonaldTrump;1168874291376650000;03.09.2019 13:12;"b'We are doing very well in our negotiations with China. While I am sure they would love to be dealing with a new administration so they could continue their practice of \xe2\x80\x9cripoff USA\xe2\x80\x9d($600 B/year)16 months PLUS is a long time to be hemorrhaging jobs and companies on a long-shot....'""";;;;;;;;
realDonaldTrump;1168714708691630000;03.09.2019 02:37;b'...Trade Agreement.\xe2\x80\x9d @business @ChuckGrassley @joniernst @SenatorFischer @BenSasse Making great progress for our Farmers. Approved E-15 year round. Big additional list to be submitted &amp;;;;;;;;
realDonaldTrump;1168714707307560000;03.09.2019 02:37;"b'\xe2\x80\x9cBrazil will allow more American Ethanol to enter the country without Tariffs a decision that Brazilian mills are celebrating. The seemingly counter-intuitive reaction stems from the tone of ongoing negotiations between the South American nation and the U.S. for a...'""";;;;;;;;
realDonaldTrump;1168664116095080000;02.09.2019 23:16;"b'....when in fact under certain original scenarios it was in fact correct that Alabama could have received some \xe2\x80\x9churt.\xe2\x80\x9d Always good to be prepared! But the Fake News is only interested in demeaning and belittling. Didn\xe2\x80\x99t play my whole sentence or statement. Bad people!'""";;;;;;;;
realDonaldTrump;1168664114677400000;02.09.2019 23:16;"b'Such a phony hurricane report by lightweight reporter @jonkarl of @ABCWorldNews. I suggested yesterday at FEMA that along with Florida Georgia South Carolina and North Carolina even Alabama could possibly come into play which WAS true. They made a big deal about this...'""";;;;;;;;
realDonaldTrump;1168583512888390000;02.09.2019 17:56;b'https://t.co/h5EMpC8hCo';;;;;;;;
realDonaldTrump;1168499357131420000;02.09.2019 12:22;"b'....The good news is that we are winning. Our real opponent is not the Democrats or the dwindling number of Republicans that lost their way and got left behind our primary opponent is the Fake News Media. In the history of our Country they have never been so bad!'""";;;;;;;;
realDonaldTrump;1168499355248200000;02.09.2019 12:22;"b'The LameStream Media has gone totally CRAZY! They write whatever they want seldom have sources (even though they say they do) never do \xe2\x80\x9cfact checking\xe2\x80\x9d anymore and are only looking for the \xe2\x80\x9ckill.\xe2\x80\x9d They take good news and make it bad. They are now beyond Fake they are Corrupt..'""";;;;;;;;
realDonaldTrump;1168496276918480000;02.09.2019 12:09;"b'The Amazon Washington Post did a story that I brought racist attacks against the \xe2\x80\x9cSquad.\xe2\x80\x9d No they brought racist attacks against our Nation. All I do is call them out for the horrible things they have said. The Democrats have become the Party of the Squad!'""";;;;;;;;
realDonaldTrump;1168493190468550000;02.09.2019 11:57;"b'....Trump Economics. With President Trump Tariffs are bringing companies back to the USA like he said they would! @SteveHiltonx'""";;;;;;;;
realDonaldTrump;1168493189050890000;02.09.2019 11:57;"b'....swing states that went to Trump in 2016 because he promised not to forget about them like the establishment had done for decades and their trust in President Trump paid off as they saw their incomes rise...And it\xe2\x80\x99s the lowest paid workers who have gained the most with....'""";;;;;;;;
realDonaldTrump;1168493188056820000;02.09.2019 11:57;b'....Average hourly wages growth has far outpaced what we saw with President Obama. Across all industries from mining and construction to leisure &amp;;;;;;;;
realDonaldTrump;1168493185758350000;02.09.2019 11:57;b'\xe2\x80\x9cThe last three years of Trump policy have finally brought real hope and real change. Unemployment this year hit a 50 year low. With President Trump we\xe2\x80\x99ve seen the lowest EVER African American and Hispanic unemployment. The booming Trump Economy has pushed up workers wages....';;;;;;;;
realDonaldTrump;1168491084818890000;02.09.2019 11:49;"b'\xe2\x80\x9cThey are liars and in my opinion TRAITORS!\xe2\x80\x9d @LouDobbs talking about Comey and his dwindling group of friends.'""";;;;;;;;
realDonaldTrump;1168490496857120000;02.09.2019 11:46;"b'....and watched. NAFTA is the worst Trade Deal ever made - terrible for labor - and Richard let it stand. No wonder unions are losing so much. The workers will vote for me in 2020 (lowest unemployment most jobs ever) and should stop paying exorbitant $Dues not worth it!'""";;;;;;;;
realDonaldTrump;1168490495980510000;02.09.2019 11:46;b'Just watched AFL-CIO President Richard Trumka on @FoxNews and thought to myself how different he is on TV than he is when he is with me at the White House. Likes what we are doing until the cameras go on. We got robbed on Trade and everything else while his Dems just sat back....';;;;;;;;
realDonaldTrump;1168488487433230000;02.09.2019 11:38;"b'Since my election many trillions of dollars of worth has been created for our Country and the Stock Market is up over 50%. If you followed the advice of the Failing New York Times columnist Paul Krugman you\xe2\x80\x99d be doing VERY poorly - you\xe2\x80\x99d be angry and hurt. He never got it!'""";;;;;;;;
realDonaldTrump;1168487909584000000;02.09.2019 11:36;"b'....adds up to the most ambitious Pro-Worker policy agenda this Country has ever seen. The President promised Jobs Jobs Jobs and that is exactly what he is delivering.\xe2\x80\x9d @SteveHiltonx @NextRevFNC @FoxNews'""";;;;;;;;
realDonaldTrump;1168487907725840000;02.09.2019 11:36;b'\xe2\x80\x9cWhen you put everything together the pro growth Tax &amp;;;;;;;;
realDonaldTrump;1168326060955570000;02.09.2019 00:53;"b'.....this (Judge Thomas Ambro Majotity Opinion) and thank God for a President like Donald J. Trump who will appoint judges like this. He will soon have appointed 180 new Federal Judges not even including two great new Supreme Court Justices.\xe2\x80\x9d @robertjeffress @LouDobbs'""";;;;;;;;
realDonaldTrump;1168326060280300000;02.09.2019 00:53;"b'\xe2\x80\x9cWe hold that legislative prayer is government speech not open to attack via those channels.\xe2\x80\x9d Third Circuit Court of Appeals. \xe2\x80\x9cLou that\xe2\x80\x99s why this next Election is so important the soul of America. They want to take religion out of American lives. Thank God for judges like....'""";;;;;;;;
realDonaldTrump;1168246061951000000;01.09.2019 19:35;"b'Pray for the people in the Bahamas. Being hit like never before Category 5.  Almost 200 MPH winds.'""";;;;;;;;
realDonaldTrump;1168178555777400000;01.09.2019 15:07;"b'Great job by Texas Law Enforcement and First Responders in handling the terrible shooting tragedy yesterday. Thank you also to the FBI @GregAbbott_TX and all others. A very tough and sad situation!'""";;;;;;;;
realDonaldTrump;1168174613827890000;01.09.2019 14:51;"b'In addition to Florida - South Carolina North Carolina Georgia and Alabama will most likely be hit (much) harder than anticipated. Looking like one of the largest hurricanes ever. Already category 5. BE CAREFUL! GOD BLESS EVERYONE!'""";;;;;;;;
realDonaldTrump;1168163118347890000;01.09.2019 14:06;b'This is only the beginning! https://t.co/mFrtBPtCcO';;;;;;;;
realDonaldTrump;1168153045026460000;01.09.2019 13:26;b'I have not forgotten that when it was announced that I was going to do The Apprentice and when it then became a big hit helping NBC\xe2\x80\x99s failed lineup greatly @DebraMessing came up to me at an Upfront &amp;;;;;;;;
realDonaldTrump;1168147289027820000;01.09.2019 13:03;b'\xe2\x80\x9cComey and McCabe (and more) are Dirty Cops.\xe2\x80\x9d Joe DiGenova';;;;;;;;
realDonaldTrump;1168146167215070000;01.09.2019 12:58;"b'....reports are coming. Comey very vulnerable. But where is the Supreme Court. Where is Justice Roberts? If you lie to a court you should be held in contempt. So if you abused the FISA you must be held accountable. I hope Justice Roberts will take action.\xe2\x80\x9d Jason Chaffetz Fox'""";;;;;;;;
realDonaldTrump;1168146165130510000;01.09.2019 12:58;"b'\xe2\x80\x9cJames Comey has been rebuked at the highest level with much more to come. An IG Report doesn\xe2\x80\x99t get any stronger calling him dangerous insubordinate. THANK GOODNESS THAT DONALD TRUMP WAS ELECTED BECAUSE IF HE WASN\xe2\x80\x99T ELECTED THESE PEOPLE WOULD STILL BE IN POWER. Two more.....'""";;;;;;;;
realDonaldTrump;1168137799712850000;01.09.2019 12:25;b'....is about American Freedom. Redirect the supply chain. There is no reason to buy everything from China!';;;;;;;;
realDonaldTrump;1168137797280170000;01.09.2019 12:25;"b'Peter Morici Economist: Tariffs will not impact American consumers that much because the Chinese currency has gone down which gives our importers a discount. Importers can find suppliers outside of China. Absolutely worth it we don\xe2\x80\x99t want to be servants to the Chinese! This...'""";;;;;;;;
realDonaldTrump;1167928855199270000;31.08.2019 22:35;b'Just briefed by Attorney General Barr about the shootings in Texas. FBI and Law Enforcement is fully engaged. More to follow.';;;;;;;;
realDonaldTrump;1167893379461440000;31.08.2019 20:14;"b'\xe2\x80\x9cThe vindication belongs to the President for firing James Comey. It was clearly the right thing to do. You don\xe2\x80\x99t want an FBI Director with Jim Comey\xe2\x80\x99s ethics.\xe2\x80\x9d Jason Riley Wall Street Journal'""";;;;;;;;
realDonaldTrump;1167876729538400000;31.08.2019 19:08;"b'Enjoy the low gas prices over the Labor Day weekend! My energy policies have made America energy independent while keeping prices low just like a Tax Cut. The Democrats \xe2\x80\x9cgreen\xe2\x80\x9d policies will raise your price of gas! https://t.co/iBS1UQul7A'""";;;;;;;;
realDonaldTrump;1167876404945380000;31.08.2019 19:06;"b'....but now we are moving forward like never before. We are winning again and we are respected again!'""";;;;;;;;
realDonaldTrump;1167876317745860000;31.08.2019 19:06;"b'Being scolded by failed former \xe2\x80\x9cIntelligence\xe2\x80\x9d officials like James Clapper on my condolences to Iran on their failed Rocket launch. Sadly for the United States guys like him Comey and the even dumber John Brennan don\xe2\x80\x99t have a clue. They really set our Country back....'""";;;;;;;;
realDonaldTrump;1167867052410800000;31.08.2019 18:29;"b'Just watched Congresswoman Debbie Dingell and many other Democrats wanting to give up on our very successful Trade battle with China which has had its worst Economic year in memory (and getting worse). We are taking in $Billions. Will be big for Farmers and ALL!'""";;;;;;;;
realDonaldTrump;1167805241926060000;31.08.2019 14:24;"b'Has anyone noticed that the top shows on @foxnews and cable ratings are those that are Fair (or great) to your favorite President me! Congratulations to @seanhannity for being the number one show on Cable Television!'""";;;;;;;;
realDonaldTrump;1167800370292240000;31.08.2019 14:04;b'Dan will be GREAT! https://t.co/5zfVFweUCh';;;;;;;;
realDonaldTrump;1167799335096130000;31.08.2019 14:00;"b'Looking like our great South Carolina could get hit MUCH harder than first thought. Georgia and North Carolina also. It\xe2\x80\x99s moving around and very hard to predict except that it is one of the biggest and strongest (and really wide) that we have seen in decades. Be safe!'""";;;;;;;;
realDonaldTrump;1167786555509000000;31.08.2019 13:09;"b'MAKE AMERICA GREAT AGAIN which is happening and then KEEP AMERICA GREAT!'""";;;;;;;;
realDonaldTrump;1167786066985840000;31.08.2019 13:07;"b'I was right about Comey CROOKED COP!'""";;;;;;;;
realDonaldTrump;1167784531535060000;31.08.2019 13:01;"b'A great team working hard! https://t.co/QeGuomKBir'""";;;;;;;;
realDonaldTrump;1167783720021120000;31.08.2019 12:58;"b'...Yes I am currently suing various people for violating their confidentiality agreements. Disgusting and foul mouthed Omarosa is one. I gave her every break despite the fact that she was despised by everyone and she went for some cheap money from a book. Numerous others also!'""";;;;;;;;
realDonaldTrump;1167782135786330000;31.08.2019 12:52;"b'While Madeleine Westerhout has a fully enforceable confidentiality agreement she is a very good person and I don\xe2\x80\x99t think there would ever be reason to use it. She called me yesterday to apologize had a bad night. I fully understood and forgave her! I love Tiffany doing great!'""";;;;;;;;
realDonaldTrump;1167771834059750000;31.08.2019 12:11;"b'\xe2\x80\x9cThe IG found that James Comey leaked Classified Documents to his attorneys which can be (is) a violation of the Espionage Act. This is consistent with all the lies that Comey has been spreading. @GreggJarrett  @ByronYork @LouDobbs'""";;;;;;;;
realDonaldTrump;1167771830947590000;31.08.2019 12:11;b'Cory is doing a Great job for Colorado! https://t.co/OmsGvWL9E3';;;;;;;;
realDonaldTrump;1167770637789740000;31.08.2019 12:06;b'Nobody knows more about Healthcare than John. Great guy! https://t.co/T4i0UYqLqd';;;;;;;;
realDonaldTrump;1167769103240760000;31.08.2019 12:00;"b'An amazing guy respected by all! https://t.co/S814IXvHc4'""";;;;;;;;
realDonaldTrump;1167768685349670000;31.08.2019 11:58;b'Nobody works harder or smarter than Joni! https://t.co/vqvW5I8ngI';;;;;;;;
realDonaldTrump;1167768683105650000;31.08.2019 11:58;b'One of the greats! https://t.co/14o0j9aZfj';;;;;;;;
realDonaldTrump;1167766772398850000;31.08.2019 11:51;b'Great job Thom! https://t.co/N8mHjP1PHI';;;;;;;;
realDonaldTrump;1167765375972510000;31.08.2019 11:45;b'Thank you Kevin. Great things are happening at the Border! https://t.co/gR71Z1Au8;b';;;;;;;
realDonaldTrump;1167651639806890000;31.08.2019 04:13;"b'I am monitoring Hurricane Dorian and receiving frequent briefings and updates. It is important to heed the directions of your State and Local Officials. This is an extremely dangerous storm please prepare and be safe! @FEMA @NWS @NOAA @Readygov @FLSERT https://t.co/Fee9EB1wQk'""";;;;;;;;
realDonaldTrump;1167586397924050000;30.08.2019 23:54;"b'....pass the laugh test and the Inspector General just knocked that down.\xe2\x80\x9d @ByronYork  @LouDobbs'""";;;;;;;;
