Account;Tweet_Nr;Date_Time;Tweet;;;;;;;;
realDonaldTrump;1231397086551310000;23.02.2020 01:55;b'Just another Shifty Schiff leak. Isn\xe2\x80\x99t there a law about this stuff? https://t.co/JWE0oPhiw9';;;;;;;;
realDonaldTrump;1231372451893970000;23.02.2020 00:17;b'\xe2\x80\x9cThe Kremlin is reportedly backing Bernie Sanders bid to win the White House.\xe2\x80\x9d Jon Scott  @FoxNews  Why didn\xe2\x80\x99t somebody tell me this?';;;;;;;;
realDonaldTrump;1231366964611860000;22.02.2020 23:55;b'Looks like Crazy Bernie is doing well in the Great State of Nevada. Biden &amp;;;;;;;;
realDonaldTrump;1231345462793440000;22.02.2020 22:30;b'Look so forward to being with my great friends in INDIA! https://t.co/1jdk3AW6fG';;;;;;;;
realDonaldTrump;1231343206039720000;22.02.2020 22:21;"b'Wow great foresight! https://t.co/RDmjYT18wz'""";;;;;;;;
realDonaldTrump;1231302822785950000;22.02.2020 19:40;b'https://t.co/tOBcudSlcl';;;;;;;;
realDonaldTrump;1231236777744250000;22.02.2020 15:18;b'Democrats in the Great State of Nevada (Which because of the Economy Jobs the Military &amp;;;;;;;;
realDonaldTrump;1231221743647430000;22.02.2020 14:18;b'\xe2\x80\x9cAn investigation into NOTHING.\xe2\x80\x9d The wonderful @trish_regan on the Mueller Witch Hunt!';;;;;;;;
realDonaldTrump;1231070547607510000;22.02.2020 04:17;"b'Incredible people great Rally! https://t.co/3i6tgfqrRl'""";;;;;;;;
realDonaldTrump;1231065736807940000;22.02.2020 03:58;b'Good luck Angela! https://t.co/M4KVeGZsqo';;;;;;;;
realDonaldTrump;1231064642514030000;22.02.2020 03:54;"b'Simply put he choked! https://t.co/4GeJMvTO2j'""";;;;;;;;
realDonaldTrump;1231062039617060000;22.02.2020 03:43;"b'....The reason for this is that the Do Nothing Democrats using disinformation Hoax number 7 don\xe2\x80\x99t want Bernie Sanders to get the Democrat Nomination and they figure this would be very bad for his chances. It\xe2\x80\x99s all rigged again against Crazy Bernie Sanders!'""";;;;;;;;
realDonaldTrump;1231062038979410000;22.02.2020 03:43;b'MSDNC (Comcast Slime) @CNN and others of the Fake Media have now added Crazy Bernie to the list of Russian Sympathizers along with @TulsiGabbard &amp;;;;;;;;
realDonaldTrump;1230982069301320000;21.02.2020 22:26;b'Republicans are fighting for citizens from every background every community &amp;;;;;;;;
realDonaldTrump;1230979334237600000;21.02.2020 22:15;"b'THANK YOU Las Vegas Nevada! I was delighted to be back in a state I love with proud hardworking PATRIOTS. With your help this November we are going to defeat the Radical Socialist Democrats and we are going to win Nevada in a landslide! #KAG2020 \nhttps://t.co/tCxQIDICAH'""";;;;;;;;
realDonaldTrump;1230936104234120000;21.02.2020 19:23;b'ON MY WAY! #KAG2020\xf0\x9f\x87\xba\xf0\x9f\x87\xb8\nhttps://t.co/oubu6tCG4m';;;;;;;;
realDonaldTrump;1230908583333590000;21.02.2020 17:34;"b'So @TeamCavuto has very bad ratings on @foxnews with his Fake guests like A.B.Stoddard and others that still haven\xe2\x80\x99t figured it all out. Will he get the same treatment as his friend Shepherd Smith who also suffered from the ratings drought?'""";;;;;;;;
realDonaldTrump;1230889667853070000;21.02.2020 16:19;b'@SenateGOP Highest Trump Poll Numbers EVER! Thank you!';;;;;;;;
realDonaldTrump;1230884976977040000;21.02.2020 16:00;b'Mitch and I have made great progress. Coming back fast! https://t.co/ksJRH2UzlE';;;;;;;;
realDonaldTrump;1230882784937260000;21.02.2020 15:51;b'Four great candidates are under consideration at DNI. Decision within next few weeks!';;;;;;;;
realDonaldTrump;1230881724445240000;21.02.2020 15:47;b'Great! https://t.co/eDf8ltInmH';;;;;;;;
realDonaldTrump;1230879049460760000;21.02.2020 15:36;"b'Another misinformation campaign is being launched by Democrats in Congress saying that Russia prefers me to any of the Do Nothing Democrat candidates who still have been unable to after two weeks count their votes in Iowa. Hoax number 7!'""";;;;;;;;
realDonaldTrump;1230875946334310000;21.02.2020 15:24;"b'IF OUR FORMALLY TARGETED FARMERS NEED ADDITIONAL AID UNTIL SUCH TIME AS THE TRADE DEALS WITH CHINA MEXICO CANADA AND OTHERS FULLY KICK IN THAT AID WILL BE PROVIDED BY THE FEDERAL GOVERNMENT PAID FOR OUT OF THE MASSIVE TARIFF MONEY COMING INTO THE USA!'""";;;;;;;;
realDonaldTrump;1230738935195680000;21.02.2020 06:20;b'\xe2\x80\x9cShe should never have been on that jury. Everything about this stinks.\xe2\x80\x9d @JudgeJeanine @seanhannity @FoxNews';;;;;;;;
realDonaldTrump;1230738031985840000;21.02.2020 06:16;"b'Great Rally In Colorado. Thank you will be back soon!'""";;;;;;;;
realDonaldTrump;1230701508083120000;21.02.2020 03:51;"b'Thank you to our great US Ambassador to Germany @RichardGrenell for stepping in to serve as acting DNI. I will be nominating a terrific candidate for the job very soon. Stay tuned!'""";;;;;;;;
realDonaldTrump;1230678480896930000;21.02.2020 02:19;"b'I was thrilled to be back in Colorado Springs tonight beneath the majestic peaks of the Rocky Mountains with thousands of terrific hardworking American Patriots. With your help this November we are going to defeat the Radical Socialist Dems and we are going to WIN Colorado! https://t.co/uagWRzFlBs'""";;;;;;;;
realDonaldTrump;1230637051520790000;20.02.2020 23:35;"b'Wow thank you \xe2\x80\x94 on my way!! https://t.co/iGs4UQKLfF'""";;;;;;;;
realDonaldTrump;1230636340141670000;20.02.2020 23:32;"b'Just arrived in Colorado see everyone soon! https://t.co/53jW6iKIjn'""";;;;;;;;
realDonaldTrump;1230611451431150000;20.02.2020 21:53;"b'Could somebody at @foxnews please explain to Trump hater A.B. Stoddard (zero talent!) and @TeamCavuto that I won every one of my debates from beginning to end. Check the polls taken immediately after the debates. The debates got me elected. Must be Fox Board Member Paul Ryan!'""";;;;;;;;
realDonaldTrump;1230600551131270000;20.02.2020 21:10;"b'It was my great honor to deliver the commencement address at the @LVMPD\xe2\x80\x99s Hope for Prisoners Graduation Ceremony today where we reaffirmed that America is a nation that believes in REDEMPTION! https://t.co/WwJ5eHjTzl'""";;;;;;;;
realDonaldTrump;1230558752966760000;20.02.2020 18:24;b'\xe2\x80\x9cThe real winner last night was Donald Trump.\xe2\x80\x9d Mini Mike Bloomberg. I agree!';;;;;;;;
realDonaldTrump;1230557232615440000;20.02.2020 18:18;b'\xe2\x80\x9cThe decision not to prosecute Andy McCabe is utterly inexplicable.\xe2\x80\x9d @Judgenap  @HARRISFAULKNER @FoxNews';;;;;;;;
realDonaldTrump;1230541046360100000;20.02.2020 17:13;"b'\xe2\x80\x9cI don\xe2\x80\x99t think there\xe2\x80\x99s any chance whatsoever of Senator Sanders defeating President Trump.\xe2\x80\x9d Mini Mike Bloomberg. Mini there\xe2\x80\x99s even less chance especially after watching your debate performance last night of you winning the Democrat nomination...But I hope you do!'""";;;;;;;;
realDonaldTrump;1230514772338060000;20.02.2020 15:29;"b'John Kerry and Senator Chris Murphy grossly violated the Logan Act with respect to Iran. If a Republican did what they did there would be very serious ramifications!'""";;;;;;;;
realDonaldTrump;1230513001054090000;20.02.2020 15:22;"b'\xe2\x80\x9cThey say Roger Stone lied to Congress.\xe2\x80\x9d @CNN  OH I see but so did Comey (and he also leaked classified information for which almost everyone other than Crooked Hillary Clinton goes to jail for a long time) and so did Andy McCabe who also lied to the FBI! FAIRNESS?'""";;;;;;;;
realDonaldTrump;1230495013634630000;20.02.2020 14:10;b'This makes Mini Mike look good compared to his performance last night. Worst debate performance in history! https://t.co/oUTz9njZPg';;;;;;;;
realDonaldTrump;1230486093906110000;20.02.2020 13:35;b'A really great moment! https://t.co/wLGzGi34Rv';;;;;;;;
realDonaldTrump;1230484215344450000;20.02.2020 13:27;"b'This is the REAL Mini Mike. He admitted many times that he is \xe2\x80\x9ca fan of Donald Trump. He\xe2\x80\x99s a New York ICON.\xe2\x80\x9d Thank you Mike! https://t.co/KkqMdVMcdk'""";;;;;;;;
realDonaldTrump;1230471520553590000;20.02.2020 12:37;b'.@JRubinBlogger (Jennifer Rubin) the wacko \xe2\x80\x9cconservative\xe2\x80\x9d of the @washingtonpost must learn how to spell the name Bloomberg before it is too late &amp;;;;;;;;
realDonaldTrump;1230384588553210000;20.02.2020 06:52;b'https://t.co/eXpCUQDwU5';;;;;;;;
realDonaldTrump;1230376522663390000;20.02.2020 06:19;"b'Mini Mike Bloomberg\xe2\x80\x99s debate performance tonight was perhaps the worst in the history of debates and there have been some really bad ones. He was stumbling bumbling and grossly incompetent. If this doesn\xe2\x80\x99t knock him out of the race nothing will. Not so easy to do what I did!'""";;;;;;;;
realDonaldTrump;1230376132970630000;20.02.2020 06:18;"b'Thank you Arizona! With your help your devotion and your drive we are going to keep on working we are going to keep on fighting and we are going to keep ON WINNING! America is thriving like never before and the BEST IS YET TO COME! https://t.co/e3tlNLzU7p'""";;;;;;;;
realDonaldTrump;1230372246427860000;20.02.2020 06:02;b'\xe2\x80\x9cWhat has happened to Roger Stone should never happen to anyone in our Country again.\xe2\x80\x9d @TuckerCarlson @FoxNews';;;;;;;;
realDonaldTrump;1230351482827850000;20.02.2020 04:40;b'https://t.co/1XnhyX8jb2';;;;;;;;
realDonaldTrump;1230349601854500000;20.02.2020 04:32;"b'The Democrat party is the party of high taxes high crime open borders late-term abortion socialism blatant corruption and the total destruction of your Second Amendment. The Republican Party is the party of the American Worker the American Family and the American Dream! https://t.co/GhyS5MD8Q9'""";;;;;;;;
realDonaldTrump;1230344927449500000;20.02.2020 04:14;"b'A beautiful evening in Phoenix Arizona with Great American Patriots. THANK YOU! https://t.co/kZ9fDTBiXa'""";;;;;;;;
realDonaldTrump;1230303229381970000;20.02.2020 01:28;b'Wow! https://t.co/pXcAIFUt1u';;;;;;;;
realDonaldTrump;1230287400762340000;20.02.2020 00:25;"b'....for the wonderful job he has done and we look forward to working with him closely perhaps in another capacity within the Administration!'""";;;;;;;;
realDonaldTrump;1230287397377620000;20.02.2020 00:25;"b'I am pleased to announce that our highly respected Ambassador to Germany @RichardGrenell will become the Acting Director of National Intelligence. Rick has represented our Country exceedingly well and I look forward to working with him. I would like to thank Joe Maguire....'""";;;;;;;;
realDonaldTrump;1230285216217880000;20.02.2020 00:17;"b'I AM ON MY WAY SEE YOU SOON! https://t.co/EgUBqPNlYh'""";;;;;;;;
realDonaldTrump;1230280522363890000;19.02.2020 23:58;"b'Heading to Arizona big rally and big crowd! #MAGA #KAG2020'""";;;;;;;;
realDonaldTrump;1230186794576010000;19.02.2020 17:46;"b'Rod Blagojevich did not sell the Senate seat. He served 8 years in prison with many remaining. He paid a big price. Another Comey and gang deal! Thank you to @LisaMarieBoothe who really \xe2\x80\x9cgets\xe2\x80\x9d what\xe2\x80\x99s going on! @FoxNews'""";;;;;;;;
realDonaldTrump;1230177751954380000;19.02.2020 17:10;"b'Internal REAL Polls show I am beating all of the Dem candidates. The Fake News Polls (here we go again just like 2016) show losing or tied. Their polls will be proven corrupt on November 3rd just like the Fake News is corrupt!'""";;;;;;;;
realDonaldTrump;1230157993284530000;19.02.2020 15:51;"b'I would like to thank John Rood for his service to our Country and wish him well in his future endeavors! https://t.co/kPA1rYCKvp'""";;;;;;;;
realDonaldTrump;1230155765349920000;19.02.2020 15:42;"b'Highest Stock Market In History By Far!'""";;;;;;;;
realDonaldTrump;1230143683699170000;19.02.2020 14:54;"b'Is corrupt Bloomberg News going to say what a pathetic debater Mini Mike is that he doesn\xe2\x80\x99t respect our great farmers or that he has violated campaign finance laws at the highest and most sinister level with \xe2\x80\x9cpayoffs\xe2\x80\x9d all over the place?'""";;;;;;;;
realDonaldTrump;1230141397094690000;19.02.2020 14:45;b'Kerry &amp;;;;;;;;
realDonaldTrump;1230135934626050000;19.02.2020 14:23;"b'There must be JUSTICE. This can never happen to a President or our Country again! https://t.co/5epW4JPYkF'""";;;;;;;;
realDonaldTrump;1229921804992440000;19.02.2020 00:13;b'Congratulations to Eddie DeBartolo Jr. and your wonderful family of friends! https://t.co/IJu93xjiQS';;;;;;;;
realDonaldTrump;1229897691590580000;18.02.2020 22:37;b'...And this despite Fake Witch Hunts the Mueller Scam the Impeachment Hoax etc. With our Economy Jobs Military Vets 2A &amp;;;;;;;;
realDonaldTrump;1229897661555210000;18.02.2020 22:37;b'THANK YOU! #MAGA #KAG2020 https://t.co/uWMjL52f5O';;;;;;;;
realDonaldTrump;1229894633280260000;18.02.2020 22:25;"b'I hope the Federal Judges Association will discuss the tremendous FISA Court abuse that has taken place with respect to the Mueller Investigation Scam including the forging of documents and knowingly using the fake and totally discredited Dossier before the Court. Thank you!'""";;;;;;;;
realDonaldTrump;1229888362841980000;18.02.2020 22:00;"b'Mini Mike. No I would rather run against you!'""";;;;;;;;
realDonaldTrump;1229871184193280000;18.02.2020 20:51;"b'.....Mini is illegally buying the Democrat Nomination. They are taking it away from Bernie again. Mini Mike Major Party Nominations are not for sale! Good luck in the debate tomorrow night and remember no standing on boxes!'""";;;;;;;;
realDonaldTrump;1229871176614190000;18.02.2020 20:51;"b'What Mini Mike is doing is nothing less than a large scale illegal campaign contribution. He is \xe2\x80\x9cspreading\xe2\x80\x9d money all over the place only to have recipients of his cash payments many former opponents happily joining or supporting his campaign. Isn\xe2\x80\x99t that called a payoff? .....'""";;;;;;;;
realDonaldTrump;1229866940912390000;18.02.2020 20:35;"b'Chris Jacobs will be a great Congressman who will always fight for the people of New York. He supports our #MAGA Agenda will continue to Secure Our Border Loves our Military Vets and is Strong on the #2A. Chris has my Complete Endorsement for the Special Election on 4/28!'""";;;;;;;;
realDonaldTrump;1229863299358940000;18.02.2020 20:20;"b'The Mayor\xe2\x80\x99s efforts to shield illegal aliens endangers the lives of the public and law enforcement who have to go into the field to apprehend those released. He shouldn\xe2\x80\x99t be urging illegals to beat the system he should be urging them to safely turn themselves in! https://t.co/sSJodorcVr'""";;;;;;;;
realDonaldTrump;1229790568110260000;18.02.2020 15:31;"b'.....would order a new trial I\xe2\x80\x99m not so sure about Judge Jackson I don\xe2\x80\x99t know.\xe2\x80\x9d @Judgenap (Andrew Napolitano) @foxandfriends'""";;;;;;;;
realDonaldTrump;1229790566721950000;18.02.2020 15:31;b'.....existence of these tweets in which you were so harshly negative about the President &amp;;;;;;;;
realDonaldTrump;1229790563668500000;18.02.2020 15:31;b'\xe2\x80\x9cJudge Jackson now has a request for a new trial based on the unambiguous &amp;;;;;;;;
realDonaldTrump;1229790102949440000;18.02.2020 15:29;b'....THE UNITED STATES IS OPEN FOR BUSINESS!';;;;;;;;
realDonaldTrump;1229790101728890000;18.02.2020 15:29;"b'....I have seen some of the regulations being circulated including those being contemplated by Congress and they are ridiculous. I want to make it EASY to do business with the United States not difficult. Everyone in my Administration is being so instructed with no excuses...'""";;;;;;;;
realDonaldTrump;1229790100797730000;18.02.2020 15:29;"b'....product and goods to China and other countries. That\xe2\x80\x99s what trade is all about. We don\xe2\x80\x99t want to make it impossible to do business with us. That will only mean that orders will go to someplace else. As an example I want China to buy our jet engines the best in the World....'""";;;;;;;;
realDonaldTrump;1229790099866600000;18.02.2020 15:29;b'The United States cannot &amp;;;;;;;;
realDonaldTrump;1229767823595010000;18.02.2020 14:01;"b'The Crooked DNC is working overtime to take the Democrat Nomination away from Bernie AGAIN! Watch what happens to the Super Delegates in Round Two. A Rigged Convention!'""";;;;;;;;
realDonaldTrump;1229756039475680000;18.02.2020 13:14;b'....BUT MAYBE I STILL WILL. WITCH HUNT!';;;;;;;;
realDonaldTrump;1229756038469070000;18.02.2020 13:14;"b'....badly tainted and in my opinion should be thrown out. Even Mueller\xe2\x80\x99s statement to Congress that he did not see me to become the FBI Director (again) has been proven false. The whole deal was a total SCAM. If I wasn\xe2\x80\x99t President I\xe2\x80\x99d be suing everyone all over the place...'""";;;;;;;;
realDonaldTrump;1229756032693470000;18.02.2020 13:14;"b'These were Mueller prosecutors and the whole Mueller investigation was illegally set up based on a phony and now fully discredited Fake Dossier lying and forging documents to the FISA Court and many other things. Everything having to do with this fraudulent investigation is...'""";;;;;;;;
realDonaldTrump;1229752040039100000;18.02.2020 12:58;"b'.....would order a new trial I\xe2\x80\x99m not so sure about Judge Jackson I don\xe2\x80\x99t know.\xe2\x80\x9d @Judgenap (Andrew Napolitano) @foxandfriends'""";;;;;;;;
realDonaldTrump;1229752039040780000;18.02.2020 12:58;b'.....existence of these tweets in which you were so harshly negative about the President &amp;;;;;;;;
realDonaldTrump;1229752034460600000;18.02.2020 12:58;b'\xe2\x80\x9cJudge Jackson now has a request for a new trial based on the unambiguous &amp;;;;;;;;
realDonaldTrump;1229616977825730000;18.02.2020 04:01;b'Thank you Clint! https://t.co/MTYAIiilna';;;;;;;;
realDonaldTrump;1229604453822670000;18.02.2020 03:12;"b'Praying for Ryan Newman a great and brave @NASCAR driver! #PrayingForRyan'""";;;;;;;;
realDonaldTrump;1229551222648160000;17.02.2020 23:40;b'....ever. Had to rebuild our military which was totally depleted. Fed Rate UP taxes and regulations WAY DOWN. If Dems won in 2016 the USA would be in big economic (Depression?) &amp;;;;;;;;
realDonaldTrump;1229551220248930000;17.02.2020 23:40;b'Did you hear the latest con job? President Obama is now trying to take credit for the Economic Boom taking place under the Trump Administration. He had the WEAKEST recovery since the Great Depression despite Zero Fed Rate &amp;;;;;;;;
realDonaldTrump;1229519051514350000;17.02.2020 21:32;b'https://t.co/MQWM6Y9c4D';;;;;;;;
realDonaldTrump;1229517316188240000;17.02.2020 21:25;b'Completion of the Daytona 500 on Fox Network now. Enjoy!';;;;;;;;
realDonaldTrump;1229423626438530000;17.02.2020 15:13;"b'\xe2\x80\x9cThey tried to Impeach the President eight times before this last Impeachment trial that we went through. In Arizona people are tired of their obstruction their investigations and their Impeachments. They want them to get to work.\xe2\x80\x9d @SenMcSallyAZ  @foxandfriends  Thanks Martha'""";;;;;;;;
realDonaldTrump;1229409252344810000;17.02.2020 14:16;b'HAPPY PRESIDENT\xe2\x80\x99S DAY!';;;;;;;;
realDonaldTrump;1229204331112600000;17.02.2020 00:42;b'#DAYTONA500 https://t.co/fT8L0EZqXh';;;;;;;;
realDonaldTrump;1229091017732780000;16.02.2020 17:11;b'Last week the Fake News said that a section of our powerful under construction Southern Border Wall \xe2\x80\x9cfell over\xe2\x80\x9d trying to make it sound terrible except the reason was that the concrete foundation was just poured &amp;;;;;;;;
realDonaldTrump;1229064138820930000;16.02.2020 15:25;b'Getting ready to go to the Daytona 500. Will be GREAT!';;;;;;;;
realDonaldTrump;1228811405907950000;15.02.2020 22:40;"b'Thank you to @JackBrewerBSI for your kind words on the great progress we have made on our powerful African-American Agenda. For one lowest unemployment numbers in USA history. Many other great records!  @foxandfriends  @FoxNews'""";;;;;;;;
realDonaldTrump;1228810227321060000;15.02.2020 22:36;b'BIG PROGRESS! https://t.co/DfWA7FRSGQ';;;;;;;;
realDonaldTrump;1228810073171950000;15.02.2020 22:35;"b'Remember will be at Daytona 500 tomorrow!'""";;;;;;;;
realDonaldTrump;1228808910213130000;15.02.2020 22:30;"b'Years ago the Democrats had the money to build the Wall but they didn\xe2\x80\x99t have any idea how to get it done. I am building it bigger and better than ever thought possible! https://t.co/VMioZcRPfj'""";;;;;;;;
realDonaldTrump;1228804504268750000;15.02.2020 22:13;b'Thank you David! https://t.co/yElxOFxqYu';;;;;;;;
realDonaldTrump;1228690354314120000;15.02.2020 14:39;b'IG report on Andrew McCabe: Misled Investigators over roll in news media disclosure...Lacked Candor (Lied) on four separate occasions...Authotized Media Leaks to advance personal interests...IG RECOMMENDED MCCABE\xe2\x80\x99S FIRING. @FoxNews @IngrahamAngle';;;;;;;;
realDonaldTrump;1228666362886750000;15.02.2020 13:04;"b'.....biggest test of his presidency emboldened ready to claim exoneration and take his case of grievance persecution and resentment to the campaign trail.\xe2\x80\x9d Peter Baker  @nytimes  The Greatest Witch Hunt In American History!'""";;;;;;;;
realDonaldTrump;1228666350635290000;15.02.2020 13:04;"b'\xe2\x80\x9cRalph Waldo Emerson seemed to foresee the lesson of the Senate Impeachment Trial of President Trump. \xe2\x80\x98When you strike at the King Emerson famously said \xe2\x80\x9cyou must kill him.\xe2\x80\x99 Mr. Trump\xe2\x80\x99s foes struck at him but did not take him down. A triumphant Mr.Trump emerges from the.....'""";;;;;;;;
realDonaldTrump;1228655829273970000;15.02.2020 12:22;"b'MAKE AMERICA GREAT AGAIN and then KEEP AMERICA GREAT! https://t.co/eV9fZxzxgi'""";;;;;;;;
realDonaldTrump;1228468353486000000;14.02.2020 23:57;b'Nice! https://t.co/5EVJVAPxjL';;;;;;;;
realDonaldTrump;1228463577335550000;14.02.2020 23:38;"b'Great honor I think?  Mark Zuckerberg recently stated that \xe2\x80\x9cDonald J. Trump is Number 1 on Facebook. Number 2 is Prime Minister Modi of India.\xe2\x80\x9d Actually I am going to India in two weeks. Looking forward to it!'""";;;;;;;;
realDonaldTrump;1228449937211390000;14.02.2020 22:44;"b'.@LouieGohmertTX1 is a Fantastic Republican from the Great State of Texas! He fully supports our #MAGA and #KAG Agenda Border WALL Military Vets and your Second Amendment. Louie is my friend and has my Complete and Total Endorsement! https://t.co/7MWH000IbI'""";;;;;;;;
realDonaldTrump;1228449065148570000;14.02.2020 22:40;"b'I look forward to attending the Daytona 500 on Sunday with lots of my great friends from Florida including the France family and @RepMichaelWaltz from #FL6. See you there good luck to everyone! @NASCAR @SenRickScott @marcorubio @GovRonDeSantis https://t.co/e0SUl4GfBm'""";;;;;;;;
realDonaldTrump;1228446619500150000;14.02.2020 22:31;"b'Thank you Arnold very nice. https://t.co/didAAHILFk'""";;;;;;;;
realDonaldTrump;1228446339207480000;14.02.2020 22:30;"b'....Today @FLOTUS and I encourage all Americans to cherish and honor the memory of those we have lost through acts of love and service. We will hold Parkland forever in our hearts.'""";;;;;;;;
realDonaldTrump;1228446338091820000;14.02.2020 22:30;"b'It has been two years since the tragedy in Parkland. We will always mourn the innocent lives taken from us \xe2\x80\x93 14 wonderful students and 3 terrific educators. Earlier this week I met with families whose experiences from that horrible day still pierce the soul....'""";;;;;;;;
realDonaldTrump;1228442887081290000;14.02.2020 22:16;b'.@TomMcClintock is a strong Conservative Leader who will always fight for the people of California. He fully supports our #MAGA Agenda will continue to Secure Our Border Loves our Military &amp;;;;;;;;
realDonaldTrump;1228439060106050000;14.02.2020 22:01;b'.@JodeyArrington from the Great State of Texas has been an incredible supporter of our #MAGA Agenda. Jodey fully supports Securing our Border w/ the WALL he Loves our Military &amp;;;;;;;;
realDonaldTrump;1228438881969880000;14.02.2020 22:00;b'.@MoInTheHouse Brooks is running for Congress in the Great State of Alabama. He is a huge supporter of the #MAGA Agenda. Mo fully supports Securing our Border w/the WALL he Loves our Military &amp;;;;;;;;
realDonaldTrump;1228438298584140000;14.02.2020 21:58;"b'\xe2\x80\x9cThe Greatest name in politics\xe2\x80\x9d Patrick @McHenryCampaign from the Great State of North Carolina is a Conservative Fighter and a true Leader who ALWAYS supports our #MAGA Agenda. Patrick has my Complete and Total Endorsement! https://t.co/t1ciRWONff'""";;;;;;;;
realDonaldTrump;1228418892663480000;14.02.2020 20:41;b'Thank you to the beautiful country of Cambodia for accepting the @CarnivalCruise ship Westerdam into your port. The United States will remember your courtesy! @MickyArison';;;;;;;;
realDonaldTrump;1228341384131770000;14.02.2020 15:33;"b'It is happening again to Crazy Bernie just like last time only far more obvious. They are taking the Democrat Nomination away from him and there\xe2\x80\x99s very little he can do. A Rigged System!'""";;;;;;;;
realDonaldTrump;1228339772348910000;14.02.2020 15:26;b'95% Approval Rating in the Republican Party. Thank you!';;;;;;;;
realDonaldTrump;1228339437685390000;14.02.2020 15:25;b'....always continue. Every Republican Senator except Romney many highly religious people all very smart voted against the Impeachment Hoax. @SenCapito was all in (a great person). I was told by many that Manchin was just a puppet for Schumer &amp;;;;;;;;
realDonaldTrump;1228339433323290000;14.02.2020 15:25;b'I was very surprised &amp;;;;;;;;
realDonaldTrump;1228338223786680000;14.02.2020 15:20;"b'\xe2\x80\x9cPresident Trump with smart policies has done more to help the Black community than any President in the modern era.\xe2\x80\x9d @IngrahamAngle @FoxNews'""";;;;;;;;
